<?xml version="1.0"?>
<Dataset name="test1" dapVersion="4.0" xml:base="file:/Users/jimg/src/shrew/xml/dap/tests-dap4/dap-4-test1.xml"
    xmlns="http://xml.opendap.org/ns/DAP/4.0#" 
    xmlns:dap="http://xml.opendap.org/ns/DAP/4.0#"
    xmlns:xml="http://www.w3.org/XML/1998/namespace" 
    xmlns:xlink="http://www.w3.org/1999/xlink"
    xmlns:xsi="http://www.w3.org/2001/XMLSchema-instance"
    xsi:schemaLocation="http://xml.opendap.org/ns/DAP/4.0#  file:/Users/jimg/src/shrew/xml/dap/dap4.xsd">
        
    <Group>
        <Dimension name="x" size="1024"/>
        <Dimension name="y" size="1024"/>
        
        <Grid name="SST">
            <Array name="MSST">
                <Attribute name="long_name" type="String">
                    <value>Model Sea Surface Temperature</value>
                </Attribute>
                <type>
                    <Byte/>
                </type>
                <dimensions>
                    <dim name="run_number" size="7"/>
                    <dim ref="latitude"/>
                    <dim ref="longitude"/>
                </dimensions>
            </Array>
            
            <Map name="latitude" type="Float32">
                <Attribute name="maybe" type="UByte"><value>255</value></Attribute>
                <dimensions>
                    <dim ref="x"/>
                    <dim ref="y"/>
                </dimensions>
            </Map>
            
            <Map name="longitude" type="Float32">
                <dimensions>
                    <dim ref="x"/>
                    <dim ref="y"/>
                </dimensions>
            </Map>
        </Grid>
    </Group>
</Dataset>